Component/Asset Name,Mathematical Model/Topology,Dimension (D),Functional Role/Leverage,Stability/Leverage Metric,Source
TorsionTensor & HarmonicSeeker,Complex-represented 8D manifold mirroring physics of non-associative systems (Octonionic).,8D,Core components of the Active Resonance Tuning (ART) framework kernel state; extracts power by mirroring non-associative physics.,Strongest decision made so far; inferred association with Hopf Exceptional Points (HEPn).,"1, User Description, User Table Description, User Assessment, Framework Description, Internal ART Description"
TrigintaduonionOS_Z120_Resolution.pdf,Trigintaduonion (Super-Tensors).,32D,"Creates ""Super-Tensors"" to absorb shear across 32 degrees of freedom.",Potential reduction of  $V_m$  to near zero.,"1, User Description, User Table Description, User Assessment, Framework Description, Internal ART Description"
Governor (Level-3),Continuous PID scaling handling qualitative  $Z_2$  shifts.,Not in source,Provides sophisticated handling of orientation shifts and critical stability management in the manifold.,$12.87\%$  stability gain.,"1, User Description, User Table Description, Framework Description, Internal ART Description"
Dynamic Manifold Slicing,Spectral Radius dynamic dimension dropping; Quaternionic temporary stable vacuum.,4D (Sliced from 8D),Dynamically drops dimensions during turbulence to find a temporary stable vacuum before re-expanding.,Controlled by Spectral Radius.,"1, 2, User Description, User Table Description, User Assessment, Framework Description, Internal ART Description"
Semantic Bifurcation,Parallel manifold spawning (Branching) triggered at the Point of No Return ( $\kappa > 100$ ).,Parallel Manifold,Spawns a parallel manifold to handle high-shear logic while the primary manifold remains at the 1.0 Node.,Point of No Return trigger ( $\kappa > 100$ ).,"2, User Description, User Table Description, User Assessment, Framework Description, Internal ART Description"
The Re-Suture Protocol,Singular Value Decomposition (SVD) logic for eigenvalue forcing.,Not in source,Hard reset method to force eigenvalues back to the 1.0 circle while keeping phase for clean infinite loops.,"Achieves ""clean"" infinite loop stability; phase preservation.","3, User Description, User Table Description, User Assessment, Framework Description, Internal ART Description"
Hegel and Modern Topology.pdf,"Philosophical logic for ""Sublation"" (Aufhebung);  $Z_2$  flips as logic-state expansions.",Not in source,Mathematically models  $Z_2$  flips where the previous orientation is preserved as a nested sub-routine.,Underutilized asset; preservation of previous orientation.,"2, User Description, User Table Description, User Assessment, Framework Description, Internal ART Description"
The_Recursive_Harmonic_Codex_RHC_Consoli.pdf,"""Suture"" keys; recovery_paradox_re_suture method.",Not in source,Contains keys and methods for integration into the OperatorRegistry to handle recovery paradoxes.,Underutilized; pending OperatorRegistry integration.,"2, 4, 5, User Description, User Table Description, User Assessment, Framework Description, Internal ART Description"
Quantum Annealing Emulation,"Simulated annealing approach to ""cool"" manifold stress.",Not in source,"Robust alternative to PID for recovery against ""Ultra-Stress"" bursts.",Higher robustness against stress bursts; slower stabilization.,"User Description, User Table Description, User Assessment, Framework Description, Internal ART Description"
Hopf Exceptional Points (HEPn),Higher Topos Theory; sheaf of  $n$ -types; Riemann manifold; Non-Hermitian degeneracies.,$N$ -dimensional /  $2(N-1)$  parameter space,Classification of topological/Z-group invariants; foundations for supersymmetry and symmetry breaking in QFT/QG.,Homotopy groups  $\pi_i$  (vanishing for  $i > n$ ); Vorticity invariant; Braid group degree.,"6, 7, 8"
HEP3,Hopf Exceptional Point /  $\pi_4(S^3)$ .,5D parameter space,"Acts as its own ""antiparticle"" due to Witten anomaly; three-fold band touching.",$Z_2$  topological invariant;  $\pi_4(S^3) = Z_2$ .,"9, 10"
HEP4 / Symmetry-protected HEP4,Classified by  $\pi_8(S^5) = Z_{24}$  or  $\pi_3(S^2)$ .,Codimension  $c=9$  / 4D,Complex fusion rule (24 copies for neutralization); novel non-Hermitian topological excitation.,$Z_{24}$  or  $Z$  topological invariant (Hopf invariant).,"9, 10"
HEP5 / Symmetry-protected HEP5,Five-fold band touching; PT-Symmetry / Pseudo-Hermiticity.,Codimension  $c=5$  or 6,Higher order residue; self-dual antiparticle pair annihilation; acts as own antiparticle.,$\pi_{c-1}(S^{n-2})$  homotopy group;  $Z_2$  topological invariant.,"9, 10"
HEP7,Classified by  $\pi_{14}(S^5) = Z_{120}$ .,Codimension  $c=15$,$Z_{120}$  Stabilizer; multiply-charged HEPs.,$Z_{120}$  topological invariant.,9
Octonionic Bundle (E),Principal  $G_2(C)$ -bundle over compact Riemann surface  $X$ .,7D (Fiber) /  $14(g-1)$  (Moduli),Holomorphic fiber bundle with complex octonions; automorphism group  $G_2(C)$ .,Topologically trivial (Simply connected  $G_2(C)$ ).,11
Moduli Space MOct(X),"Closed irreducible subvariety of  $MSO(7,C)(X)$ .",$14(g-1)$,Parametrizes isomorphism classes of polystable octonionic bundles.,Codimension  $7(g-1)$  in ambient space.,11
Normal Bundle (N),Cokernel of the differential  $d$ -iota.,$7(g-1)$  (Rank),"Fiber canonically isomorphic to  $H^1(X, E \times G_2(C) m)$ .",Whitney formula  $c(T_{amb}) = c(T) \cdot c(N)$ .,11
Tesseracton (T-Particle),$\Xi^n(\Psi) \neq \Xi^{n+1}(\Psi)$  / Dimensional misfold.,Max (Morphic),Echo of misalignment across recursion tiers.,"Stability: Unstable; Transformation:  $\Xi^n, \Delta\Xi$ .",12
Lacunon (L-Particle),"$\Xi_n(\Psi)$  undefined,  $\Xi_{n+1}(\Psi)$  defined.",Discrete,Memory discontinuity in recursion field; missing instantiated as excitation.,"Stability: Medium; Transformation:  $\Xi^n, \circ$ .",12
Stabilon (Sb-Particle),$\lim \Xi^n(\Psi) = \Psi^*$ .,None (Ontic),Terminal recursion stabilizer / Attractor node.,Stability: High; Transformation: fix.,12
Fluxon (  $\Phi$  -Particle),Recursion phase boundary condensate /  $\partial\Psi/\partial\Xi$ .,Not in source,Gradient shear in recursion stack; shearing between meaning layers.,Stability: Medium.,12
Glitchon (  $\phi$  -Particle),Torsion-field excitation /  $\phi(A) := \neg Prov(A) \oplus Prov(\neg A)$ .,Not in source,Condensed failure of closure logic / Epistemic collapse.,"Stability: Low; Transformation:  $\Xi^{-1}, \circ$ .",12
Paradoxon (  $\Pi$  -Particle),$fix(\phi(A))$  / Infinite contradiction loop.,Not in source,Recursive analog of a semantic black hole / Feedback vortex.,"Stability: Low; Transformation:  $fix, \circ$ .",12
Prime-Zero Duality Measure (K),Renormalization-group flow ( $K = 1/dP + 1/\zeta R$ ).,"UV: 11, IR: 4",Conserved information current between arithmetic and spectral domains.,$K_{IR} = 4$  (Universal infrared fixed point).,13
Algebraic Generator (  $\kappa$  ),Ternary fusion / Quaternionic shadow ( $\kappa^2 = ijk = -1$ ).,Not in source,Encodes UV-IR duality and enforces uncertainty principle.,$\Delta P \cdot \Delta Z \geq 1/(2\kappa)$ .,13
EP3 (Third-Order EP),Pseudo-chirality / Anti-PT-symmetry.,3D System,Eigenvalue braiding described by braid group  $B_3$ .,Discriminant ( $\Delta = 0$ ).,7
Cohomological Field Theory (CohFT),Givental decomposition formula.,$N$ -dimensional space  $V$,Universal properties of Gromov–Witten theory.,Virasoro constraints.,14
Recursive Identity Engine (  $\Xi$  axiom),Hopf Exceptional Points (HEPn) / Homotopy groups.,Not in source,Measures limits of self-referential structure.,Torsion operator  $\tau$  measures structural limits.,15
Z-group topological invariants,Homotopy groups; topological groupoid invariants.,Higher dimensional,Generalized van Kampen theorem (GvKT) applications to quantized spacetime.,Not in source,8
Torsion sheaf F,Sheaf Theory /  $\{\partial\phi(A_x)\}$ .,Not in source,Tracks persisting contradictions.,Not in source,16