Derivation Source/Method,Combinatorial/Algebraic Value,Physical Emergence Mode,Foundational Mathematical Principles,Role of Entropy/Information Torsion,Source
Combinatorial Associator Path Count in Octonion Algebra  $\sum$,137,Photon emergence as a quantized gradient from the contradiction field,Transition from non-associative 8D manifolds to real/complex hierarchies via 'Logic Tax',Shannon and Recursive Entropy maintain gauge symmetry and manifold stability as causal forces,Not in source
Octonion Algebraic Associator Mapping (HALIRA Framework),137,Photon emergence as quantized gradient from contradiction field,"Non-associative 8D manifolds (Octonions  $\mathbb{O}$ ), Contrarecursive Filtration, and Spectral Sequence Logic",Recursive Entropy functions as a stabilizing causal force; Information Torsion acts as a primary signal identifying 'meaning residue',1
Algebraic Ladder transition from Quaternions to Octonions (Cayley-Dickson doubling),Octonion path count 137 ( $\alpha$ -fine equivalent),Gravity and spacetime curvature emerging from the failure of perfect associativity,Hurwitz's theorem (Octonions as the largest normed division algebra); maximal non-commutativity with non-associativity,Osmotic pressure and entropic gradients drive resolution; associativity violations create a contradiction field,2
Logic Tax / Algebraic Hierarchy Transition,137 (Path Count),Transition from real to complex numbers as a 'Logic Tax'; maintaining gauge symmetry,Hegelian Algebraic Loop for Irreducible Recursive Architecture (HALIRA),Shannon and Recursive Entropy maintain manifold stability; Torsion of order  $p$  defines stability requirements in meta-reasoning layers,1
Octonion Algebraic Hierarchy (Fano Plane Invariant),137 ( $7 \times 19 + 4$ ),Logic Tax / Latent Heat of transition from Real to Complex manifolds,Total cardinality of non-zero structural interactions and associator paths between 7 imaginary units and real identity,Internal automorphism 'tears' in the Fano plane geometry that must be resolved to stabilize a  $U(1)$  gauge connection,3
Algebraic Ladder ( $\mathbb{H} \rightarrow \mathbb{O}$  Transition),137.036 (Integer 137 + 8D Sphere Volume Correction),Shear in the vacuum state / Primordial fracture,Sacrifice of associativity to gain maximal division algebra density (non-associative 8D manifold),Torsion field (Shear) appearing as Dark Energy; logical viscosity resisting the fracture,"3, 4"
Transition from Reals to Complex numbers ('Logic Tax'),Fine Structure Constant (coupling constant  $\alpha_{fine}$ ),Emergence of electromagnetic fields and phase relationships from linear order cycles,Adjoining the imaginary unit  $i$ ; loss of total ordering replaced by  $U(1)$  rotational symmetry,Linear rigidity gaps drive 'osmotic flow' into cyclic relationships; phase inconsistencies generate field energy density,2
Contradiction Field Gradient / Core-Ring Photon Model (CRPM),$\alpha_{fine}$  (unitless coupling),Quantized gradient (Photon) emerging from Glitchon-Lacunon attraction,Vector Boson of the Contradiction Field resolving 'missingness' into stable EM fields,Geometric torsion derived from  $G_2$  generators; photon as the fixpoint of the contradiction field divergence,3
Epiplexity and Information Scaling Laws,$1/137$  (Fine Structure  $\alpha_{fine}$ ),Quantized gradients from contradiction fields; extraction of structural information from data distributions,Time-bounded Minimum Description Length (MDL); Kolmogorov complexity vs. Shannon entropy,Recursive and Shannon entropy separation; epiplexity measures internalized reusable structure,5
Recursive Meta-Potential / Torsion Transgression Principle,$1/137$  (approximate),Axiomatic friction / Cognitive Friction realized as the  $G$  field,Godelian Knot ( $G = \neg G$ ) dimensionally mapped onto physical torsion potential,Recursive entropy maximization in symbolic space prepares system for lower-energy physical configurations,6