Spectral Transport Component,Physical/Gauge Interpretation,RG Flow Stability Condition,Symmetry/Stabilizer Role,Global Consistency Constraint,Low-Energy Effective Result,Source
$D_{\omega}(\ell)$  (Scale-dependent transport operator),Physical law as global consistency of recursively stabilized spectral transport,RG flow isolates stable eigensectors via spectral gaps,Admissible symmetries preserve the stabilized transport structure,Physical transport is globally consistent,$G_{\text{eff}} \cong \frac{SU(3) \times SU(2) \times U(1)}{\mathbb{Z}_6}$,"1, 2, Recursive Spectral Transport Principle, User Table Description"
Stable eigensections,Particles,RG flow isolates stable eigensectors via spectral gaps;  $\text{Spec}(D_{\omega}) \bigoplus_i E_i$,Admissible symmetries preserve stabilized transport structure; Vacuum selection corresponds to  $\phi_{\ell} \in \Gamma(\mathcal{E})$,Physical transport is globally consistent; Anomalies correspond to obstructions,"$G_{\text{eff}} \cong \frac{SU(3) \times SU(2) \times U(1)}{\mathbb{Z}_6}$ ; Minimal anomaly-free phase, doublet, and triplet stabilizers","1, 3, 4, 5, 2, 6, 7, 8, 9, Recursive Spectral Transport Principle, Table description, User Table Description"
Connection transport on  $\mathcal{E}$,Gauge interactions,RG-stable spectral decomposition; Recursive stabilization of transport sectors,Admissible symmetries preserve stabilized structure; Symmetry breaking corresponds to stabilizer reduction,Anomaly cancellation corresponds to exactness of the associated transport cocycle,"$G_{\text{eff}} \cong \frac{SU(3) \times SU(2) \times U(1)}{\mathbb{Z}_6}$ ; Minimal anomaly-free phase, doublet, and triplet stabilizers","1, 3, 4, 5, 2, 6, 7, 8, 9, Excerpts from ""Elements of ∞-Category Theory.pdf"", Recursive Spectral Transport Principle, Table description, User Table Description"
Distinguished stable section  $\phi_{\ell} \in \Gamma(\mathcal{E})$,Vacuum selection,RG-induced spectral gap isolation,Symmetry breaking corresponds to stabilizer reduction  $\mathcal{G} \to \text{Stab}(\phi_{\ell})$,Global consistency of recursively stabilized spectral transport,"Minimal anomaly-free phase, doublet, and triplet stabilizers;  $G_{\text{eff}}$  global residue","1, 3, 5, 8, 9, Recursive Spectral Transport Principle, Table description"
Monodromy of stable chiral branches,Flavor and generation structure,Minimal RG-stable nontrivial monodromy complexity,Monodromy around higher-order spectral caustics; Stabilizer reduction,Global consistency around higher-order spectral caustics; Anomalies as obstructions,Generation structure arising from minimal monodromy complexity;  $G_{\text{eff}} \cong \frac{SU(3) \times SU(2) \times U(1)}{\mathbb{Z}_6}$,"1, 3, 4, 5, 2, 6, 7, 8, 9, Excerpts from ""Elements of ∞-Category Theory.pdf"", Recursive Spectral Transport Principle, Table description, User Table Description"
Transport cocycle / Obstructions to consistency,Anomalies and anomaly cancellation,RG flow isolates stable sectors; Stabilized irreducible transport sectors,"Minimal anomaly-free phase, doublet, and triplet stabilizers",Anomaly cancellation corresponds to exactness of the associated transport cocycle,$G_{\text{eff}} \cong \frac{SU(3) \times SU(2) \times U(1)}{\mathbb{Z}_6}$ ; Admissible low-energy automorphism residue,"1, 4, 5, 6, 8, 9, Excerpts from ""Elements of ∞-Category Theory.pdf"", Recursive Spectral Transport Principle"
$\mathcal{E} = \bigoplus_i E_i \to B$,Symmetry breaking / Stabilized irreducible transport sectors,Spectral gap isolation; Stabilized irreducible transport sectors,Stabilizer reduction  $\mathcal{G} \to \text{Stab}(\phi_{\ell})$,Anomaly cancellation corresponds to exactness of the associated transport cocycle,"Minimal anomaly-free phase, doublet, and triplet stabilizers","3, 9, Excerpts from ""Elements of ∞-Category Theory.pdf"""