Algebraic Component,Physical Interaction,Symmetry Group,Clifford Algebra Mapping,Dimensionality and Space,Interaction Modeling (Inferred),Source
Octonions  ( $\mathbb{O}$ ),Strong Force / Color Force / Meta-Operators,$G_{2}$  /  $SU(3)$  /  $E_{7(7)}$,"$Cl(6)$  /  $Cl(8)$  /  $Cl(0, 8)$",8D Internal Space / 11D M-Theory / 32D Trigintaduonion Space,Unification:  Non-associativity models the highest order of gauge interactions. The split uses the self-adjoint part for gravitational metrics/mass and the anti-self-adjoint part for gauge potential fields (gluons) and quark confinement.,1-14
Quaternions  ( $\mathbb{H}$ ),Weak Force / Electroweak / Spin,"$SU(2)$  /  $SO(3)$  /  $Sp(N)$  /  $SO(5,1)$","$Cl(2)$  /  $Cl(6)$  /  $Cl(0,2)$  /  $Cl(3,0)$  /  $Cl(8)$",4D Internal Space / 6D Spacetime,Unification:  The non-commutative nature models non-abelian gauge generators. The split distinguishes between mass-generating gravity (self-adjoint velocity terms) and the anti-self-adjoint gauge bosons/positional components.,"1-13, 15-18"
Complex Numbers  ( $\mathbb{C}$ ),Electromagnetism / QED / Quantum Mechanics,"$U(1)$  /  $U(N)$  /  $SL(2,\mathbb{C})$","$Cl(2)$  /  $Cl(4)$  /  $Cl(6)$  /  $Cl(1,1)$",2D Internal Space / Phase Space,"Unification:  Phase factor automorphisms model hypercharge. Anti-self-adjoint parts represent position and gauge potential (phase rotation), while self-adjoint components bridge to spacetime geometry via eigenvalue repulsion.","1-6, 8-13, 15, 16, 19"
Real Numbers  ( $\mathbb{R}$ ),Gravity / Spacetime Geometry,"Lorentz Group  $SO(3,1)$  /  $O(N)$  / Diffeomorphism Invariance","$Cl(2)$  /  $Cl(0,1)$  /  $Cl(0,0)$",4D Minkowski Spacetime / 1D Algebraic,Unification:  Acts as the geometric backbone. Gravity is modeled via self-adjoint components (velocity/density) where eigenvalues experience repulsion as a measure of configuration volume stretching.,"1-6, 8-13, 15, 19-21"
"Mix (R, C, H)",Gravity and Gauge Forces Unification (Dirac Formalism),Poincaré Group / Lorentz Group,"$Cl(1,3)$  /  $Cl(6)$  /  $Cl(8)$","Minkowski Spacetime ( $V_{3,1}$ )","Unification:  Achieved via the Dirac connection on a Clifford bundle. The self-adjoint density element models gravity/velocity, while connection/momentum operators model gauge interactions.",15